nama_hotel,nama_pelanggan,rating,ulasan,,,
XYZ,Enal Maslan,4,"Menginap selama 4 malam pada bulan September 2018 karena saya memiliki pertemuan bisnis di tempat yang dekat dengan bandara karena hotel ini terletak di sebelah selatan Bandara Internasional Soekarno-Hatta, namun areanya agak terpencil dan jauh dari area komersial. Hanya ada minimarket dan restoran makanan lokal di dekatnya. Memesan langsung di situs web hotel dan membayar paket bisnis yang mencakup antar-jemput gratis dari dan ke bandara dan sarapan. Kamarnya bersih dan terawat dengan baik, tersedia pusat kebugaran dan kolam renang. Mencoba berbagai hidangan lokal untuk sarapan yang enak. Staf meja depan Vennysia sangat membantu dalam membantu saya mendapatkan transportasi harian ke kantor.",,,
XYZ,Fr T,3,"Lobi cukup besar untuk anggaran terbatas. Lokasi jauh dari mana-mana. Terminal bus & stasiun kereta api dekat, tetapi tidak terlalu memungkinkan untuk berkeliling kota. Kamar ok. Staf sarapan tidak sopan.",,,
XYZ,Johan Liang,5,Hotelnya bagus dan stafnya ramah,,,
XYZ,Trip.com Member,5,Hotel dan pemandangannya bagus dan yang paling penting adalah keramahannya harus ditingkatkan untuk layanan terbaik hotel bintang 4,,,
XYZ,Handoyo Wibowo,3,"Hotel yang bagus di atas rata-rata, tempat parkir yang luas, agak jauh dari Jakarta tetapi lebih dekat ke kota Tangerang. Cocok untuk teknisi yang bekerja di perusahaan/pabrik di dekatnya. Cukup dekat dengan bandara.",,,
XYZ,Jourdan Myles,4,"Menginap di sini satu malam dalam perjalanan ke Bali. Kamar bersih dan stafnya ramah. Tersedia shuttle gratis, tetapi perlu diketahui bahwa shuttle tersebut tidak terlalu sering sehingga saya hanya dapat menggunakannya satu kali.",,,
XYZ,Raihan Eka Saputra,5,Buka puasa di hotel D'prima Tangerang sangat menyenangkan dengan banyak pilihan makanan dan minuman serta pelayanannya juga sangat baik terutama untuk ms. Berangin. Terima kasih D'prima hotel,,,
XYZ,Permana Eka Satria,4,Datanglah ke restoran untuk berbuka puasa dan makan malam. Mereka menyajikan tidak banyak minuman. Makanannya enak tapi tidak terlalu istimewa bagi saya. 4 bintang akan mewakili mereka.,,,
XYZ,Trip.com Member,4.6,Pilihan bagus dengan hotel ini untuk hotel bintang 4 murah lah jangan khawatir,,,
XYZ,Rahman Dwi Saputro,5,Allium Tangerang Hotel terletak hanya 14 kilometer atau 10 menit dari Bandara Internasional Soekarno-Hatta dengan mobil melalui tol Buaran Indah atau dengan kereta bandara melalui Stasiun Kereta Batu Ceper. Dekat juga dengan Terminal Bus Poris Plawad dan pusat perbelanjaan Tangerang. semua fasilitas sudah lengkap,,,
XYZ,Edward Mangiring,3,"Hal-hal baik: membantu mengatur check-in lebih awal; variasi sarapan, kamar tidur yang nyaman dan kamar mandi yang baik; perlu perbaikan: kebersihan karpet kamar, kursi kamar tidak nyaman, tidak ada buah dan sayur segar saat sarapan. Semoga ini bisa membantu. Terima kasih.",,,
XYZ,Edo Satria,5,"hotel terbaik di tangerang, dengan pelayanan terbaik dan ramah sehingga nyaman untuk staycation disini, terima kasih kepada mas yoga garda terdepan yang telah memberikan penjelasan yang baik dan pelayanan yang ramah.",,,
XYZ,Matcha Taro,5,"Kamarnya nyaman, makanannya bervariasi dan cukup enak, harga masih terjangkau, dan pemandangan yang ditawarkan menarik.",,,
XYZ,Trip.com Member,5,"Lokasi bagus, akses mudah ke toko-toko lokal. sarapan enak. Staf yang sangat ramah dan membantu. Akan menginap lagi.",,,
XYZ,Rafki Ridwan,4,"Mengunjungi teman saya yang menginap di hotel ini. Tempatnya tampak bagus, meski agak terpencil. Kamarnya bagus, harganya masuk akal dan staf serta layanannya cukup bagus (jadi saya dengar dari teman saya).",,,
XYZ,Aristo Rusli,4,"Menikmati prasmanan yang enak dengan teman kantor beberapa hari yang lalu di kafe paris lyon (restoran hotel). Makanan 7/10, pilihan makanan cukup beragam, tempat enak dan nyaman, harga terjangkau.",,,
XYZ,Felix W,5,"Hotelnya bersih dan nyaman, ||||Apalagi lokasinya dekat dengan banyak tempat dengan akses yang mudah.||||Stafnya sangat ramah, terutama Natalia, Catrice dan Anam yang selalu siap membantu.||||Pasti akan kembali lagi ke sini.",,,
XYZ,dian nopitasari,5,"bagus tempatnya,,kalau mau datang bersama keluarga,,sangat recomended",,,
XYZ,danny apriyanto,4,Lokasinya sangat sulit ditemukan. Dekat jalan industri daan mogot. Beberapa yang tidak ada tanda ke hotel. Saya sarankan menggunakan peta Google untuk pergi ke sini.,,,
XYZ,Gunawan Susanto,5,Ballroomnya baik-baik saja. Parkir agak sulit diakses tetapi staf akan membantu Anda.. mereka sangat membantu,,,
XYZ,Endi Julianto,5,"Stafnya ramah, ramah, dan tampan, kamarnya nyaman, makanannya enak, dan begitu banyak pilihan makanan Asia dan makanan barat.",,,
XYZ,Dewi Sekarasih,3,"Lokasinya cukup jauh, bahkan sempat tersesat saat mencoba mencarinya dengan googlemap. Tapi fasilitasnya sangat bagus. Lobi besar, kafe yang bagus dan modern, toilet bersih, Musholla besar.",,,
XYZ,Yousef Halaibeh,4,Kamar bagus sangat ramah tetapi saya melihat seekor tikus di ruang makan haha. Jadi tidak bisa menikmati sarapankuâ?¦.,,,
XYZ,Belinda Ratna,4,"""ingin makan malam terlambat?
saran saya:
keluar dari lobi hotel, lalu berjalan ke timur sekitar 100 yard, dan kemudian Anda akan menemukan gerobak nasi goreng gila dan pecel lele yang murah dan patut untuk dicoba. buka sampai jam 1 pagi.
Ini bukan promosi, aku mencoba menyelamatkan perutmu, kamu bisa berterima kasih padaku nanti""",,,
XYZ,Dinnida Sulistiani Mugianti,5,"Hotel yang bagus dengan fasilitas dan lokasi yang strategis, pelayanan yang baik untuk karyawan terutama Pak Yoga",,,
XYZ,Trip.com Member,5,"Teman saya senang dengan hotel ini, kru yang baik dan penanganan yang responsif",,,
XYZ,Linda Zeng,3,"Untuk mengakses kolam renang, Anda harus melalui lobi. Karena kolam renangnya terletak di samping hotel. Dan meminta handuk untuk berenang oleh resepsionis. Sarapannya biasa saja. Drainase di kamar mandi dekat wastafel jelek. Maaf untuk mengatakannya.",,,
XYZ,Nisa Hayyatun Ikhsan,5,"Sangat merekomendasikan hotel untuk menginap, dan terima kasih atas layanan terbaiknya, Tuan Yoga. Sampai jumpa lain kali",,,
XYZ,aribowo tri,5,Bagus dan rapi dengan hotel bintang 4. Banyak pilihan kamar dengan layanan yang menawarkan reservasi nyaman dan akses cepat ke lobi.,,,
XYZ,Steven C,5,"Buat staff yg bernama Kiel saya sangat suka dengan pelayanannya, baik, ramah, pelayanan sangat cepat, mau membantu saya, enak diajak ngobrol dan sangat memuaskan, pokoknya bagus banget buat staffnya agar sukses terus",,,
XYZ,Anisha Amalia,4,"Itu bagus, dan lobinya besar dan saya suka pizza di restoran hotel. Sarapannya juga enak dan saya menyukainya. Ruangan itu baik-baik saja. Tapi kamar mandinya baik-baik saja.",,,
XYZ,Trip.com Member,5,"Anda perlu memesan hotel ini, sangat menyenangkan menginap di hotel pullman yang lebih baik",,,
XYZ,Angelina Nityasa S P,3,"Tidak disarankan menggunakan kolam renang. Itu terlalu umum.
Pelayanan bagus & tempat istirahat sejenak. Dekat bandara dan antar-jemput disediakan berdasarkan permintaan.",,,
XYZ,Jonathan Tandarma,5,"Tempat bersih, prasmanan paginya oke. Pelayanan bagus dan staf ramah ï¿½

Penerapan protokol keselamatan dan kesehatan yang baik pada masa Pandemi",,,
XYZ,Ryan Roesch,1,"Lobi penuh nyamuk tidak bisa menikmati apa pun sambil dimakan hidup-hidup. Mereka juga mengadakan pesta karyawan yang sangat bising. Kamar terkesan kotor, dindingnya bernoda, tidak tidur sama sekali. Memesan untuk 3 malam, check out setelah yang pertama.",,,
XYZ,Phillip Bennett,1,Sarapannya standar dan tidak bervariasi. Dikenakan biaya tambahan 650.000 untuk biaya yang tidak mereka peringatkan saat check-in. Ini adalah hotel penipuan. Tidak akan kembali,,,
XYZ,David Kumar,5,Pak Heri Setiawan pelayanannya baik dan terima kasih membantu,,,
XYZ,Wastu R,4,"Menurut saya lokasi hotel cukup strategis, akses mudah ke Jalan Tol.",,,
XYZ,Trip.com Member,4,"KAMU HARUS MENCINTAI IBUMU, GO BOOK ROOM DI PULLMAN CIAWI LEBIH BAIK",,,
XYZ,Bagus Mahawan,4,"Hotel yang bagus, tapi agak gelap. Secara pribadi saya tidak terlalu suka tempat gelap. Ruangan itu luas dengan jendela besar.",,,
XYZ,Cztien Sung,4,"Terlihat bagus dan bersih. Datang utk dinner buffet spesial ramadhan. Makanannya ok, lokasinya di restoran paris lyon nya",,,
XYZ,Novita Novita,5,Makanannya enak! Bersih dan staf sangat membantu. Terdapat tempat sholat (mushola) yang cukup luas,,,
XYZ,Praptono Adhi Sulistomo,5,Berada di sini untuk pertemuan bisnis. Nyaman. Terletak di tempat yang strategis di dekat Stasiun Kereta Api Batu Ceper (yang juga merupakan tempat pemberhentian kereta bandara) merupakan nilai tambah,,,
XYZ,Linda Andriani,5,itu tempat yang sangat bagus dan pelayanan yang baik. akan menjadi wanita yang sangat cantik ğ???,,,
XYZ,Lucky Herwandoko,5,Salah satu hotel bagus di Tangerang. Stasiun kereta api dan terminal bus terdekat membuat perjalanan Anda lebih mudah dari tempat Anda menginap. Bandara juga relatif dekat.,,,
XYZ,Allezaky Arfan,5,Bagus,,,
XYZ,Sofi Hidayat,5,Semuanya bagus terutama pelayanannya. Mereka sangat baik.,,,
XYZ,Tim,4,Anggota staf sangat bermanfaat dan menyenangkan. Sarapan Baufetnya oke. Saya menikmati masa tinggal saya di sini. Terima kasih!,,,
XYZ,Bayu Wicaksono,4,"Lokasi sangat strategis, lobi besar, tetapi perlu perbaikan untuk meningkatkan bau dan kelembapan, membuat sebagian orang tidak nyaman",,,
XYZ,Ali Tan,5,Baru-baru ini menghadiri upacara pernikahan di sini. Hotel ini rapi tetapi tidak terlalu besar dari sudut pandang luar.,,,
XYZ,ë?¨í??ì¢?,5,"Sangat bersih dan bagus, ramah",,,
XYZ,Joshua Wong,1,Seprai kotor dan dudukan toilet masih ada noda kencing. Saya tidak akan merekomendasikan hotel ini.,,,
XYZ,Felicitas Alfi,4,Hotel yang bagus. Lobinya menarik. Staf sangat membantu dan ramah. Saya pasti akan kembali.,,,
XYZ,Trip.com Member,4,Hotel StrategisPelayanan BagusSarapan LezatKamar Bersih dan Wangi Bagus,,,
XYZ,Josua Kristofer,3,"Kamar bagus, fasilitas bagus, tapi tempat parkir mobil jelek. Jika ada acara, lobi hotel dan restoran juga ramai dikunjungi.",,,
XYZ,Widi Tomo,5,"Sarapannya enak sekali, staf ramah baik, banyak warung kuliner di sekitar area.",,,
XYZ,Match Point,4,Hotel yang bagus dekat Bandara SHIA. Kamar bersih dan pelayanan ramah. Bayi Ayamnya enak.,,,
XYZ,Upik Dian R,4,"Kamarnya bagus, bersih dan terawat. Stafnya juga bagus. Sarapannya juga enak.",,,
XYZ,Tre Asbudi,5,"Pak yanto, Pak rizki, Pak Kevin pelayanannya sangat baik, makanannya enak sekali, tempatnya enak",,,
XYZ,Jes Jes,4,Hotelnya dekat dengan stasiun Batu Ceper. Saya suka konsep kamar mandi umum hotel ini. Ada sofa di dalamnya. Menurutku itu sesuatu yang baru bagiku,,,
XYZ,Trip.com Member,3.5,Hotel dan stafnya bagus,,,
XYZ,Trip.com Member,4,Pelayanan Yang BaikSarapan LezatKamar LuasKamar Bersih,,,
XYZ,Trip.com Member,5,Sangat menyenangkan menginap di sana lain kali. Terima kasih pelayanan yang baik dan membantu.,,,
XYZ,Farhan Syafiq Fadhillah,5,"Dengan dua kali saya menginap di sini, ini adalah hotel paling worth it di Tangerang",,,
XYZ,Wong Andry,3,Ballroom dan sound system cukup baik,,,
XYZ,Anton Creativeland,5,"Hotel ini menjadi lebih baik sekarang, direkomendasikan untuk layanan kamar & pemesanan cepat!",,,
XYZ,Trip.com Member,4,TERKADANG bahkan saat Anda merasa lelah Setidaknya Anda makan sedikit untuk menjernihkan pikiran,,,
XYZ,Ridhaz,4,Ternyata ada hotel bagus di sekitar sini. Restoran punya. Makanan lezat juga. Bagus dan direkomendasikan,,,
XYZ,Meryta OR,4,"Tempat bagus dan bersih, staf ramah, rasa makanan rata-rata (bagi saya ????)",,,
XYZ,PIJAT URUT MULIA RAGA,5,Ok,,,
XYZ,Trip.com Member,5,Itu adalah tempat yang bagus,,,
XYZ,Mira Susanti,5,"Kamar bersih, staff ramah & helpfull
Good place with good service",,,
XYZ,Doug Hunt,5,"Staf yang luar biasa, kamar bersih. Agak jauh dari bandara tetapi hotel dengan harga yang sangat bagus",,,
XYZ,Irawan Johan,3,"Toilet kurang bersih saat check in. Saluran air shower mampet. AC tidak berfungsi. Ketika saya menelepon front office mengenai AC, butuh waktu lama bagi teknisi untuk datang memperbaikinya.",,,
XYZ,Marius Nerestiuc,1,Saya tidak merekomendasikan restoran ini kepada siapa pun,,,
XYZ,Bruce Riseley,5,"Pergi ke sana untuk suatu acara. Makanan enak terorganisasi dengan baik, akan merekomendasikan tarif sangat masuk akal jadi saya akan tinggal di sana.",,,
XYZ,M Nuh Wijaya,5,"Pelayanan prima dan baik untuk karyawan, terima kasih atas rizki, hilal dan keberaniannya",,,
XYZ,stefan budhianto,5,Hotel yang sangat bagus dekat dengan stasiun kereta dan bus. Keramahan yang baik dan sarapan yang bersih dan enak,,,
XYZ,Ignatius Yudi,5,"Staf yang baik, hotel bersih dan makanan enak di restoran. Sayangnya lokasinya jauh dari kawasan perbelanjaan.",,,
XYZ,Ary Putra,3,Hanya sekedar pertemuan,,,
XYZ,Trip.com Member,5,ANDA PERLU Istirahat DAN TIDUR DI HOTEL INI SENANG SAYA TIDAK TAHU,,,
XYZ,Yustin Yosevin,5,Sayang sekali kolam renangnya masih dalam pemeliharaan.. Tapi selebihnya masih bagus. Pelayanannya bagus,,,
XYZ,Trip.com Member,5,Sangat nyaman,,,
XYZ,Trip.com Member,4,HARUS MENGAKOMODASI KITA DI KAMAR DENGAN TV BARU DAN VARIAN SALURAN YANG LEBIH BANYAK,,,
XYZ,Geert Noels,4,"Murah, kamar bagus, lobi besar.kolam renang? kecil.surat kabar gratis?, air, teh.wifi gratis",,,
XYZ,ratzy blue,3,"Meskipun perjalanan menuju hotel ini cukup sulit, hotel ini memenuhi tujuannya. Staf sangat membantu dan sopan.",,,
XYZ,01. Abednego P.R.G,5,"Wifi-nya sangat cepat, tetapi layanan kamar tutup terlalu dini",,,
XYZ,Nurgianti Agustiani,5,"Saya suka kamar, akses, dan layanan, tetapi kolamnya terlalu kecil untuk orang dewasa",,,
XYZ,Marlboro Putih Gold,4,"Lokasi sangat strategis, kamar cukup bagus, dan pelayanan sangat memuaskan",,,
XYZ,Made Yudhi (MadeY),4,hotel yang bagus secara keseluruhan kecuali untuk layanan transportasi. Butuh waktu lama untuk mengambil dari Bandara ke hotel,,,
XYZ,Trip.com Member,4,"ANDA HARUS MENGAKOMODASI KAMI DENGAN TV YANG LEBIH BESAR, TV ANDA KECIL SEPERTI ....",,,
XYZ,anggi hafiz,4,"Menu sarapan beragam, kamar bagus, akses mudah ke angkutan umum (angkot, bus, KRL)",,,
XYZ,Alfiyansyah 2005,3,Area meeting roomnya limit staff.,,,
XYZ,apeng soedarmo,3,Banyak nyamuk di restoran... Parkir gratis. Kamarnya biasa saja... Tidak sehebat yang diharapkan.,,,
XYZ,Berbagi Ilmu,4,"Tempat yang bagus, keramahtamahan yang baik. Hanya perlu perbaikan untuk makanan",,,
XYZ,deraya photography,5,"Hotel yang direkomendasikan untuk pernikahan. Dan jika Anda membutuhkan WO, silakan hubungi kami",,,
XYZ,yanyan mulyana,5,Bagus,,,
XYZ,Ilhan Rafidya,5,Sangat ramah dan baik terima kasih kepada Nendy,,,
XYZ,Dodi Mihardja,5,"Hotel yang bagus untuk dihabiskan bersama keluarga di Tangerang, keramahtamahannya baik, bersih, kolam renangnya bagus, makanannya enak, restorannya enak, dan rasanya enak",,,
XYZ,manideep kotha,5,Hotel yang bagus. Pelayanan yang sangat baik dengan kamar yang sangat baik,,,
XYZ,Yor Diana,2,"Tua, apak, pelayanannya ok. Makanannya mengerikan. Tidak akan pernah kembali lagi",,,
XYZ,IkhwanR17,5,Jadilah kenanganku ï¿½ğ???,,,
XYZ,Gilang P,5,Tempatnya strategis dengan suasana yang bagus. Staf yang bagus.,,,
XYZ,Travel World,1,"Bau busuk dari manajemen kamar tidak enak sama sekali, coba ikut fitnes ternyata tutup padahal di jam buka.",,,
XYZ,lolla widy,5,Secara keseluruhan oke bgt cong,,,
XYZ,ensa,5,Hotel terbaik untuk berkumpul keluarga untuk pertemuan bisnis untuk akhir pekan yang menyenangkan,,,
XYZ,Acep Rintoyo,5,Bagus,,,
XYZ,Nima Homayounnejad,3,Jauh dari area ramai namun nyaman jika Anda perlu berada dalam jarak 30 menit dari bandara.,,,
XYZ,ibrahim Helmi,4,Secara keseluruhan bagus. Banyak pilihan untuk sarapan. Nilai untuk uang.,,,
XYZ,Ami Raini Putriraya,5,"Menginap selama 1 malam bersama keluarga besar saya. Tempatnya bagus, dan ada kolam renangnya.",,,
XYZ,P. Tansiri,4,Kamar bagus tapi lokasinya masih cukup jauh dari Bandara,,,
XYZ,Cardinal Blues,5,"Lokasi sangat strategis, kamar sangat bagus, dan pelayanan sangat memuaskan",,,
XYZ,Satyawida P.,5,Kamar yang bagus. Makanan yang sangat enak. Pelayanannya memuaskan,,,
XYZ,Trip.com Member,5,Layak tinggal di sini,,,
XYZ,Taufiq Amd,5,"menginap selama dua bulan dan tidak ada keluhan,...dan antar-jemput gratis ke bandara...bagus",,,
XYZ,Wina Muttaqin,5,Hotel yang bagus untuk keluarga,,,
XYZ,Fahri Azizi,2,Selera restorannya sangat buruk. Untuk kamar menurut saya standar saja.,,,
XYZ,Ahmad Alm,4,Staf yang ramah dan harga yang wajar untuk kunjungan singkat. Layanan antar-jemput bandara gratis.,,,
XYZ,Trip.com Member,5,bagustttt!!!!!!!! bersih dan nyaman,,,
XYZ,Adam Reza,5,Tempat parkir terbatas untuk venue besar,,,
XYZ,Muktar Kita,5,"Hotel yang bagus, jika Anda perlu istirahat, Anda harus berada di sini",,,
XYZ,nastain,4,"Bagus dan bersih, staf sangat membantu. Agak jauh dari pusat kota tangerang.",,,
XYZ,Gab,4,Lumayan tapi sarapannya luar biasa 8/10,,,
XYZ,Tari Sutarni,5,"""Lokasi bagus
Pemandangan yang bagus
Pelayanan yang Baik
Semua fasilitas bagus""",,,
XYZ,Martin Tampubolon,5,Joss,,,
XYZ,Apep Surya,5,"allium,hh",,,
XYZ,Trip.com Member,4,woke...,,,
XYZ,Iqbal Razak,5,"Spesial rooms, wifi, meeting rooms,",,,
XYZ,Heru Widodo,5,Mantap recommended,,,
XYZ,justin kelly,5,Taman royal 3 edelweiss,,,
XYZ,Reynald Saevana,5,Manteup,,,
XYZ,Kurniawan wisnu Jati,4,Homey,,,
XYZ,Sunardi Sukadi,3,Biasa,,,
XYZ,Gandha â??Asmara78â?,5,Hotel,,,
XYZ,Aliyah R,1,"Parkir di basement terburuk di hotel ini, parkiran kosong tapi ditaro ember dengan alasan sudah ditag oleh penghuni lain yang keluar hotel sebentar, padahal seharusnya parkiran fasilitas buat semua penghuni siapa cepat dia dapat, tapi kami harus mundur jauh cari tempat yang kosong disuruh cari parkir lain yang kosong karena itu sudah milik penghuni yang nitip ke security, apa ada SOP seperti itu atau sudah ngasih uang tips agar dikeep parkirannya, kenapa saya harus mundur jauh? itu karena tidak ada fasilitas muter diparkiran ini, atau saya harus keluar hotel dulu untuk cari parkiran lagi, dan saat mobil saya mundur security parkir hanya diam saja tidak memberi pelayanan untuk bantu mengarahkan mobil kami untuk mundur padahal sangat berbahaya, SOP dihotel ini sangat buruk. Saya rasa ini kali terakhir saya nginep disini pengalaman yang sangat mengecewakan.",,,
XYZ,Carmelo Carrubba,4,"Kamera oke, harga sesuai pesanan, tarif sekitar 33 euro per satu dolar, posisi berada di all'aeroporto (sekitar 20 menit dengan taksi) tetapi quartiere abbastanza desolato",,,
XYZ,Lina R.I.,4,"Pelayanan bagus, pelayanan ok, kamar bersih dan nyaman serta letak yang strategis karena dekat denhan Stasiun kereta dan terminal bis",,,
XYZ,Tyasti Utami,4,Nilai luar biasa sangat berharga untuk harga di kelasnya. Cuma 2 km dr rumah. Dan walopun poolnya ga begitu besar tp cukup buat anak berenang. Tiap lorong dikasih disfuser tp kyanya ga begitu ngaruh krn area yg lebih luas. Compliment buat fasilitas di kamar mandi selain sikat gigi ada helmnya packingnya plastik yg ga bikin tas basah. Lokasi juga cukup strategis deket dr minimarket. Kyanya bakalan sering balik kesini.,,,
XYZ,nuri karimah,4,"Over all bagus semua dan rekomen kalo mau nginep disini, staffnya baik2, ramah, sarapannya enak berasa (biasanya sarapan hotel agak minus).. Tapi untuk dprima Minusnya di kamar adalah tv (tidak berfungsi dan semalaman hanya menonton iklan dprima)ğ???, sudah tanya staf dan bilangnya maintenance 1-2 jam nyatanya sampe checkoutğ?¤£ğ???",,,
XYZ,Ahmad Farisi,5,"Dprima Tangerang ini recomended banget buat nginep. Hotelnya mewah tapi harganya terjangkau. Pelayanannya ramah, menu sarapannya banyak dan enak. Pokoknya kesan saya waktu nginep disini tu seneng banget Alhamdulillah. Oh ya, di depan hotel juga banyak jajanan, jadi kalo malem malem laper tinggal keluar aja. Meskipun hotel sendiri juga punya menu menu istimewanya. Recomended banget.",,,
XYZ,Arni Prabawati,5,Worth the price untuk harga sekitar 500ribu.. di kolam renang free handuk dan papan renang.. sarapan enak.. kamar cukup oke,,,
XYZ,Jonathan Emilio,4,"Secara keseluruhan tidak buruk.
 Bersih, nyaman, ga berisik juga, cuma akses masuknya agak membingungkan""
Bersih, nyaman, ga berisik juga, cuma akses masuknya agak membingungkan",,,
XYZ,MY BRIDE by Rudy Li,4,Ballroom bagus dan ada beberapa ruang pertemuan.. lobinya luassss... toilet bersih... mempunyai parkir khusus utk berkebutuhan khusus,,,
XYZ,VARADHI GLOBAL IMPEX,5,Sami dan Adi keduanya adalah orang yang bertanggung jawab terbaik dan dapat diandalkan dalam kehati-hatian,,,
XYZ,timoty2604,5,"Overall its ok, resepsionisnya krg senyum",,,
XYZ,Tri Mulyantono,2,Butuh waktu lama untuk memesan makanan. Harga kamar terlalu tinggi untuk kualitasnya.,,,
XYZ,Arnold Kesumah,4,Tempat parkir terbatas untuk venue besar,,,
XYZ,Didit BP,4,Kamar sangat nyaman dan banyak variasi makanan untuk sarapan..,,,
XYZ,Syifa utami fajria,3,"Pelayanannya bagus, tapi hidangannya cukup mengecewakan.",,,
XYZ,Beni Santoso,5,Hotel yang bagus dan dekat dari stasiun tanah tinggi dan stasiun batu ceper,,,
XYZ,M Ros,1,Permintaan khusus tersebut sudah dikonfirmasi dan akan disiapkan. Bahkan tidak dekat saat checkin. F!,,,
XYZ,rizqi fitriyadhi,5,"Terbaik dan cocok untuk menginap bersama keluarga, istirahat dan pernikahan....",,,
XYZ,budizainer,4,"Tempat yang nyaman.
Mudah dijangkau. Dekat bandara. Dapat diakses dengan kereta api.",,,
XYZ,gufron hasani,3,"Hotel yang bagus sebenarnya, tapi cukup jauh dari bandara, pusat kota, dll.",,,
XYZ,Mohammad Ardhy F,5,"Tempat nyaman di pinggir kota tangerang, pelayanan dan keramahtamahannya sangat bagus, recomended ğ??ğ?¼",,,
XYZ,Peter Limarsono,5,Rekomendasi hotel di tangerang. Makanan enak dan ballroom besar,,,
XYZ,Den Jimat,5,Terbaik,,,
XYZ,Waqar Aziz,4,Alhamdulillah Hotelnya bagus nyamanğ???ğ??ğ??«,,,
XYZ,Bukan Playboy,5,"Tempat yang bagus, pemandangan indah, ballroom yang bagus.",,,
XYZ,Ferena Debineva,4,Tempat yang bagus tapi tidak terlalu dekat dari bandara,,,
XYZ,Aldrige Ricardo,5,"Hotel bintang 4, dekat dari mall dan sarapannya enak",,,
XYZ,Ivan Setiawan,4,"Tempat yang bagus untuk pesta pernikahan, sayang sekali tempat parkirnya terlalu kecil.",,,
XYZ,beni saputra,4,Permainan yang bagus untuk menginap tetapi agak jauh dari pusat kota,,,
XYZ,Media Bekasi Official,5,"Tempatnya bagus, rapi dan bersih... Ballroomnya cukup besar...",,,
XYZ,Mualif Marbawi,5,"ballroom yang sangat besar, bagus",,,
XYZ,Aysha Harmoko,5,Luar biasa,,,
XYZ,Amanto Kuli panggul PITT,5,Kerja bagus,,,
XYZ,Yunda Kufita,4,Tempat yang bagus. Tapi makan siangnya hanya sebentar.,,,
XYZ,yogie chandra Nurjaya,5,"Sarapan prasmanan, rasanya enak, suasana menyenangkan & layanan hebat.",,,
XYZ,Hamami ID,5,"Rawat inap yang sangat baik, ruang bersih dan kesehatan.",,,
XYZ,Shanty Devi,4,Tempat yang nyaman dan mewah untuk menginap atau berkumpul bersama teman dan kolega,,,
XYZ,Muhammad Rosyadhi,1,"Permintaan dikonfirmasi OK 3x oleh resepsionis, berbeda saat check in. Bahkan tidak ada solusi yang tepat. F!",,,
XYZ,Trip.com Member,4,Tidak apa-apa untuk baik-baik saja lain kali akan baik-baik saja aku benar-benar minta maaf karena baik-baik saja dan aku baik-baik saja,,,
XYZ,Kariestar,4,Hotel ini terletak di dekat Stasiun Batu Ceper Railink dan Stasiun Komuter.,,,
XYZ,Henry Eko,5,Detil yang bagus. Posting interior gaya modern. Staf yang bagus,,,
XYZ,BBad Boys,4,Murah dan bagus untuk menginap 1 atau 2 malam.,,,
XYZ,Made Somaputra,5,Pengalaman menginap yang menyenangkan di dekat mini market dan jajanan kaki lima di sekitar sana,,,
XYZ,Donny Koko,5,"Sangat Bagus!! Coba saja, Anda pasti setuju dengan saya ğ???",,,
XYZ,Sanjaya Adi Putra,5,Tempat nyaman dan makanan enak di tengah kota tangerang,,,
XYZ,Teguh Susilo,5,"Harga terjangkau, bangunan baru dan pelayanan bagus",,,
XYZ,SUSILO,5,salah satu hotel terbaik di tanggerang,,,
XYZ,Fitria Alexander,3,Banyak sekali nyamuk di lobi hotel. Sangat buruk.,,,
XYZ,Sabri Basyah,4,"Layak direkomendasikan kepada wisatawan atau teman mana pun yang menginap di Allium Hotel,Tangerang.",,,
XYZ,Trip.com Member,5,Kamar terbaik,,,
XYZ,Julius Kaurranny,4,"Layanan hebat, kamar tenang, dan makanan enak",,,
XYZ,Agus Muryadi,5,Tempat nyaman dan pelayanan prima,,,
XYZ,Tati Tati,4,Tempat yang bagus untuk menikmati makanan enak di restoran mereka...,,,
XYZ,Charly Susanto,5,Tempat yang bagus untuk resepsi pernikahan dengan pelayanan prima,,,
XYZ,Arif Maftuhin,3,Saya ada pertemuan di hotel ini. Pengalaman yang tidak terlalu bagus.,,,
XYZ,Sanderson Junian,3,Hotel yang cukup besar di sekitar rumah cluster,,,
XYZ,Doddy Suhendra,5,"Akses mudah ke dan dari Bandara Internasional Jakarta dengan kereta bandara, kamar nyaman, makanan lezat dan staf yang ramah",,,
XYZ,Trip.com Member,5,Hotel yang bagus dengan staf yang ramah.,,,
XYZ,Ivan Carlos,5,Pemandangan lobi hotel sangat bagus...,,,
XYZ,C32P5 Saepudin,4,Hotel allium bagus untuk Reuni..untuk pelajar.,,,
XYZ,Kristian Ekawalta Ginting,5,"Tempat makannya enak, lain kali patut dicoba",,,
XYZ,Ponram Karuppiah,4,"Hotel bagus, dekat dengan bandara 30 menit berkendara.",,,
XYZ,DHANI'erS World,4,Semuanya baik-baik saja. Cuma menu sarapannya saja tidak recomended,,,
XYZ,Normal Tan,4,Hotel yang bagus untuk menginap tetapi jauh dari pusat.. remore,,,
XYZ,Gunawan Wijaya,5,Hotel yang indah... desain yang bagus,,,
XYZ,Setiawan Roesman,5,Kafe Paris Lyon di area merokok. Terbaik,,,
XYZ,Ramses Sinaga (ramsesinaga),5,"Mereka sarapannya enak, direkomendasikan",,,
XYZ,Cva Cavalera,4,"Tempat yang bagus, tapi kolamnya kecil ğ??",,,
XYZ,Ricky Anwar,3,"Allium melakukannya lebih baik, maaf....",,,
XYZ,Corinna,3,Sedikit usang... Staf yang ramah dan bersih,,,
XYZ,Ğ?ĞµÑ?Ğ° Ğ?Ğ¸Ğ±Ñ?Ğ»Ñ?,5,Terima kasih atas layanan pelanggan â¤ï¸,,,
XYZ,Muhammad Firdaus,5,Suasana nyaman dan direkomendasikan untuk bisnis atau keluarga,,,
XYZ,Rudy Asahi,4,Bersih nyaman tapi sarapannya kurang enak,,,
XYZ,Aliaksandr Kavaliou,1,layanan pelanggan terburuk,,,
